{
  "version": "0.1.0",
  "generated_at": "2025-01-27T10:00:00Z",
  "window_days": 30,
  "scores": [
    {
      "oratore": "Mario Rossi",
      "gruppo": "Partito Democratico",
      "pp_score": 78.5,
      "last_updated": "2025-01-27T10:00:00Z",
      "confidence_interval": {
        "lower": 75.2,
        "upper": 81.8
      },
      "components": {
        "Q": 82.0,
        "K": 79.5,
        "V": 76.0,
        "I": 80.0,
        "R": 75.0
      },
      "metrics": {
        "interventions_count": 15,
        "fallacies_detected": 2,
        "duplicates_count": 0,
        "stance_consistency": 0.88
      }
    },
    {
      "oratore": "Giulia Verdi",
      "gruppo": "Lega",
      "pp_score": 65.2,
      "last_updated": "2025-01-27T10:00:00Z",
      "confidence_interval": {
        "lower": 61.5,
        "upper": 68.9
      },
      "components": {
        "Q": 68.0,
        "K": 62.0,
        "V": 58.0,
        "I": 55.0,
        "R": 83.0
      },
      "metrics": {
        "interventions_count": 12,
        "fallacies_detected": 5,
        "duplicates_count": 1,
        "stance_consistency": 0.72
      }
    },
    {
      "oratore": "Antonio Neri",
      "gruppo": "Forza Italia",
      "pp_score": 71.8,
      "last_updated": "2025-01-27T10:00:00Z",
      "confidence_interval": {
        "lower": 68.1,
        "upper": 75.5
      },
      "components": {
        "Q": 75.0,
        "K": 70.0,
        "V": 72.0,
        "I": 68.0,
        "R": 76.0
      },
      "metrics": {
        "interventions_count": 18,
        "fallacies_detected": 3,
        "duplicates_count": 2,
        "stance_consistency": 0.85
      }
    },
    {
      "oratore": "Elena Bianchi",
      "gruppo": "Movimento 5 Stelle",
      "pp_score": 69.5,
      "last_updated": "2025-01-27T10:00:00Z",
      "confidence_interval": {
        "lower": 65.8,
        "upper": 73.2
      },
      "components": {
        "Q": 72.0,
        "K": 68.0,
        "V": 65.0,
        "I": 62.0,
        "R": 80.0
      },
      "metrics": {
        "interventions_count": 14,
        "fallacies_detected": 4,
        "duplicates_count": 0,
        "stance_consistency": 0.78
      }
    },
    {
      "oratore": "Marco Gialli",
      "gruppo": "Fratelli d'Italia",
      "pp_score": 83.2,
      "last_updated": "2025-01-27T10:00:00Z",
      "confidence_interval": {
        "lower": 80.1,
        "upper": 86.3
      },
      "components": {
        "Q": 85.0,
        "K": 82.0,
        "V": 80.0,
        "I": 85.0,
        "R": 86.0
      },
      "metrics": {
        "interventions_count": 20,
        "fallacies_detected": 1,
        "duplicates_count": 0,
        "stance_consistency": 0.92
      }
    },
    {
      "oratore": "Sofia Rossi",
      "gruppo": "Azione",
      "pp_score": 76.8,
      "last_updated": "2025-01-27T10:00:00Z",
      "confidence_interval": {
        "lower": 73.5,
        "upper": 80.1
      },
      "components": {
        "Q": 78.0,
        "K": 75.0,
        "V": 78.0,
        "I": 76.0,
        "R": 77.0
      },
      "metrics": {
        "interventions_count": 16,
        "fallacies_detected": 2,
        "duplicates_count": 0,
        "stance_consistency": 0.89
      }
    },
    {
      "oratore": "Luca Verdi",
      "gruppo": "Italia Viva",
      "pp_score": 68.5,
      "last_updated": "2025-01-27T10:00:00Z",
      "confidence_interval": {
        "lower": 64.8,
        "upper": 72.2
      },
      "components": {
        "Q": 70.0,
        "K": 65.0,
        "V": 68.0,
        "I": 65.0,
        "R": 74.0
      },
      "metrics": {
        "interventions_count": 13,
        "fallacies_detected": 4,
        "duplicates_count": 1,
        "stance_consistency": 0.75
      }
    },
    {
      "oratore": "Anna Bianchi",
      "gruppo": "Sinistra Italiana",
      "pp_score": 74.2,
      "last_updated": "2025-01-27T10:00:00Z",
      "confidence_interval": {
        "lower": 70.8,
        "upper": 77.6
      },
      "components": {
        "Q": 76.0,
        "K": 72.0,
        "V": 75.0,
        "I": 73.0,
        "R": 75.0
      },
      "metrics": {
        "interventions_count": 17,
        "fallacies_detected": 3,
        "duplicates_count": 0,
        "stance_consistency": 0.82
      }
    }
  ]
}
